A1N6HTHWYSWFUT,過去12ヵ月間で92％が肯定的,316,有限会社　丸大日野屋,0458226812,１８横浜市中区日本大通り神奈川県2310021JP,倉知,ひのや,https://www.amazon.co.jp/sp?_encoding=UTF8&seller=A1N6HTHWYSWFUT
A2OW2B1G8JZWCY,過去12ヵ月間で93％が肯定的,28,M.A.Y-オンラインストア,+8108079343096,中央区千代田４－９－１５－２相模原市神奈川県2520237JP,斑目雄司,M.A.Y-オンラインストア【すり替え防止対策実施中】古物商許可証番号:第452760017768,https://www.amazon.co.jp/sp?_encoding=UTF8&seller=A2OW2B1G8JZWCY
AJWGU0VLHHL35&,過去12ヵ月間で98％が肯定的,45,WELLUP住所:大沢町160-1岸和田市大阪府5960114JP運営責任者名:INOUE店舗名:WELLUP ONLINE SHOP,引法に基づく表記販売業者:WELLUP,大沢町160-1岸和田市大阪府5960114JP,INOUE,WELLUP ONLINE SHOP,https://www.amazon.co.jp/sp?_encoding=UTF8&seller=AJWGU0VLHHL35&
A3569TYZYBAF&s,過去12ヵ月間で89％が肯定的,184,chihiro takuma,+817083664412,ｍｉｎａｍｉａｏｙａｍａ２－２－１５ｍｉｎａｔｏｋｕｔｏｋｙｏｔｏ1070062JP,chihiro takuma,24EXPRESS【365日年中無休】【丁寧・エコ発送】※ご購入前に必ず説明欄をお読みください,https://www.amazon.co.jp/sp?_encoding=UTF8&seller=A3569TYZYBAF&s
A3NOVZPY37IW72,過去12ヵ月間で95％が肯定的,366,吉田　光翼,09080605049,倉益　２９３－５岡山市　中区岡山県7038263JP,yoshida kouyoku,K.R.B-SHOP(東北地方は別途送料が発生します),https://www.amazon.co.jp/sp?_encoding=UTF8&seller=A3NOVZPY37IW72
A331RUG5D2Y4JZ,過去12ヵ月間で99％が肯定的,197,POPSTAR☆★,+81905347581,伊賀市猪田1360-1三重県518-0123JP,POPSTAR☆★,POPSTAR☆★,https://www.amazon.co.jp/sp?_encoding=UTF8&seller=A331RUG5D2Y4JZ
A1GKWLAMQL2VK&,過去12ヵ月間で96％が肯定的,52,オアシス,07074733185,大阪市阿倍野区阪南町2-21-8-101大阪市大阪府5450021JP,田中,オアシス,https://www.amazon.co.jp/sp?_encoding=UTF8&seller=A1GKWLAMQL2VK&
A1N6HTHWYSWFUT,過去12ヵ月間で92％が肯定的,316,有限会社　丸大日野屋,0458226812,１８横浜市中区日本大通り神奈川県2310021JP,倉知,ひのや,https://www.amazon.co.jp/sp?_encoding=UTF8&seller=A1N6HTHWYSWFUT
A2OW2B1G8JZWCY,過去12ヵ月間で93％が肯定的,28,M.A.Y-オンラインストア,+8108079343096,中央区千代田４－９－１５－２相模原市神奈川県2520237JP,斑目雄司,M.A.Y-オンラインストア【すり替え防止対策実施中】古物商許可証番号:第452760017768,https://www.amazon.co.jp/sp?_encoding=UTF8&seller=A2OW2B1G8JZWCY
